activity_pref_label	activity_order	item_order	question	unit	details	field_type	choices	item	item_pref_label	visibility	validation	item_description	include	mandatory	preamble	bids_status	bids_file	bids_key	bids_key_for_unit	UUID
Experimental design	1	1	Type of design			select	blocked | event_related | hybrid block/event	type_of_design	type of design	1		type of design	1	1	Describe your experimental design					8d5b882e-a70a-42cc-a21d-df0507098abe
Experimental design	1	2	Number of imaging runs acquired			integer	0		number of imaging runs	1		number of imaging runs	1	2						8f545043-4a0e-4673-a869-77ea777ce760
Experimental design	1	3	Number of blocks, trials or experimental units per imaging run			integer	0		number of experimental units	1		number of experimental units	1	2						c854f735-7720-4283-9aad-965fdea1438a
Experimental design	1	4	Length of each imaging run	seconds		float	0		length of runs	1		length of runs	1	2						b146ecd0-1176-4f37-afb4-b759b27a961b
Experimental design	1	5	For blocked designs, length of blocks	seconds		float	0		length of blocks	type_of_design in  [0, 2]		length of blocks	1	2						03aa4121-3511-45cf-b57c-14fa2383e1d9
Experimental design	1	6	Length of individual trials	seconds		float	0		length of trials	1		length of trials	1	2						9abe2cdf-da71-46a3-86fa-e9c4d6515733
Experimental design	1	7	Was the design optimized for efficiency?			radio	preset:boolean		optimization	1		optimization	1	2						45b983f7-f5f8-4f98-8f1b-77e1a5b24af0
Experimental design	1	8	What method was used for optimization?			textarea			optimization method	optimization == 1		optimization method	1	3						edcc4b11-6722-4faf-82d7-eabfe8fa849f
Participants	2	1	Number of subjects entering into the analysis			integer	0		number of subjects	1		number of subjects	1	1	Describe your participant sample					d81f2226-08c7-4948-9f12-cc52e4a1631a
Participants	2	2	Mean age of subjects			float	0 | 120	subject_age_mean	subject age mean	1		subject age mean	1	1						740a7da5-cc1b-45bf-af3a-ab04bdc2a76c
Participants	2	3	Minimum age of subjects			float	0 | 120	subject_age_min	subject age min	1	subject_age_min > subject_age_mean, minimum age must be less than mean age	subject age min	1	2						6c0580ce-9d5f-4ad8-86ac-4c01bfe331af
Participants	2	4	Maximum age of subjects			float	0 | 120	subject_age_max	subject age max	1	subject_age_max < subject_age_mean, maximum age must be more than mean age	subject age max	1	2						6aefd344-5514-4dc8-a19d-0e2fc86c1e73
Participants	2	5	Handedness of subjects			radio	right | left | both		handedness	1		handedness	1	2						802c7695-309d-49fb-857f-2202c4ee2199
Participants	2	6	The proportion of subjects who were male			float	0 | 1		proportion male subjects	1		proportion male subjects	1	2						fab8d618-0597-4708-b7db-4c118e61e754
Participants	2	7	Additional inclusion/exclusion criteria, if any.		Including specific sampling strategies that limit inclusion to a specific group, such as laboratory members.	textarea			inclusion exclusion criteria	1		inclusion exclusion criteria	1	3						9fab0806-1cc7-4a56-8111-9f5c5ecb7bb4
Participants	2	8	Number of subjects scanned but rejected from analysis			integer	0		number of rejected subjects	1		number of rejected subjects	1	2						0bf8bce2-21bd-40d0-857b-0eee3717b1be
Participants	2	9	Was this study a comparison between subject groups?			radio	preset:boolean		group comparison	1		group comparison	1	1						f8411db2-8adb-4321-8f98-5307a825e27c
Participants	2	10	A description of the groups being compared			textarea			group description	group_comparison == 1		group description	1	2						f2027095-c28e-495a-aead-79f44e03e6ce
MRI acquisition	3	1	Manufacturer of MRI scanner			select	Siemens | Philips | General Electric | other	Manufacturer	scanner make	1		scanner make	1	1	Describe your acquisition parameters					4fe10df1-bc16-413b-8fe2-c7683ce14bff
MRI acquisition	3	2	Model of MRI scanner			textarea		ManufacturersModelName	scanner model	1		scanner model	1	1						aa1019db-43d0-4e63-9fd6-e5f12cc29007
MRI acquisition	3	3	Field strength of MRI scanner	Tesla		float	0 | 20	MagneticFieldStrength	field strength	1		field strength	1	1						bcbfd917-14aa-49ab-a62c-fb9da0b897be
MRI acquisition	3	4	Description of pulse sequence used for fMRI			select	Gradient echo | Spin echo | Mutliband gradient echo | MPRAGE | MP2RAGE | FLASH | other	PulseSequenceType	pulse sequence	1		pulse sequence	1	1						d17531c0-1882-4be7-a882-2e6a4a293885
MRI acquisition	3	5	Description of parallel imaging method and parameters			textarea			parallel imaging	1		parallel imaging	1	3						060b42c8-5f5d-4994-918e-ae9442a689a3
MRI acquisition	3	6	Imaging field of view	Millimeters		float			field of view	1		field of view	1	2						d6791785-7b0a-40ad-918e-57746d52381f
MRI acquisition	3	7	Matrix size for MRI acquisition			integer			matrix size	1		matrix size	1	2						826c29d0-3094-47d0-b1fb-defdd506c6fd
MRI acquisition	3	8	Distance between slices (includes skip or distance factor).	Millimeters		float	0		slice thickness	1		slice thickness	1	1						b990ab84-725e-46d9-8f32-86484cbb59dd
MRI acquisition	3	9	The size of the skipped area between slices.	Millimeters		float	0		skip factor	1		skip factor	1	2						72606a07-b1fe-41b6-b326-45fa1d1caa8f
MRI acquisition	3	10	The orientation of slices			radio	axial | sagittal | frontal		acquisition orientation	1		acquisition orientation	1	2						cefb3ba0-9098-4406-9b47-ac7b58d5706b
MRI acquisition	3	11	Order of acquisition of slices			select	ascending | descending | interleaved	SliceTiming	order of acquisition	1		order of acquisition	1	3						4dbfddb3-dcfa-4027-a78c-2e64bc7b625b
MRI acquisition	3	12	Repetition time (TR)	Milliseconds		float	0	RepetitionTime	repetition time	1		repetition time	1	1						1b7c33d8-02cd-4a5a-9ae0-edacf48d271b
MRI acquisition	3	13	Echo time (TE)	Milliseconds		float	0	EchoTime	echo time	1		echo time	1	1						886d64cc-86d0-4bec-935d-0aef81dffcb5
MRI acquisition	3	14	Flip angle	Degrees		float	0	FlipAngle	flip angle	1		flip angle	1	2						2b54fe1b-c2ee-4fd4-bceb-2aa6775760ff
Preprocessing	4	1	If a single software package was used for all analyses, specify that here			select	preset:mri_softwares	SoftwareName	software package	1		software package	1	1	Describe your preprocessing					4b721f99-b97e-4110-872d-531583e9ad29
Preprocessing	4	2	Version of software package used			textarea		SoftwareVersion	software version	1		software version	1	1						0235a056-0073-4146-b8f1-8c3a3d10a124
Preprocessing	4	3	Specify order of preprocessing operations			textarea			order of preprocessing operations	1		order of preprocessing operations	1	2						56fbfdc8-00d0-4b23-8ae9-ee62a28f3e6a
Preprocessing	4	4	Describe quality control measures			textarea			quality control	1		quality control	1	3						459f231d-5811-47e2-b5be-cbb107de4900
Preprocessing	4	5	Was B0 distortion correction used?			radio	preset:boolean		used b0 unwarping	1		used b0 unwarping	1	2						6bf9f31a-84bf-4d2b-aafd-0eda6e468fdf
Preprocessing	4	6	Specify software used for distortion correction if different from the main package			select	preset:mri_softwares		b0 unwarping software	used_b0_unwarping == 1		b0 unwarping software	1	3						34853724-e7f4-4fdd-9697-1697eac94415
Preprocessing	4	7	Was slice timing correction used?			radio	preset:boolean		used slice timing correction	1		used slice timing correction	1	1						f78a031a-82ca-4581-84ce-3557f2340e91
Preprocessing	4	8	Specify software used for slice timing correction if different from the main package			select	preset:mri_softwares		slice timing correction software	used_slice_timing_correction == 1		slice timing correction software	1	3						abb6fc5a-215d-46b3-b630-4c20c36cdf79
Preprocessing	4	9	Was motion correction used?			radio	preset:boolean		used motion correction	1		used motion correction	1	1						0aac6acf-392d-4d0f-a107-64927f8fd64c
Preprocessing	4	10	Specify software used for motion correction if different from the main package			select	preset:mri_softwares		motion correction software	used_motion_correction == 1		motion correction software	1	3						953ffe14-aa99-424b-af1c-3ba438b369d1
Preprocessing	4	11	Reference scan used for motion correction			textarea			motion correction reference	used_motion_correction == 1		motion correction reference	1	3						e1f3df67-0e4f-4346-bffe-04649d6e6dec
Preprocessing	4	12	Similarity metric used for motion correction			select	preset:cost_functions		motion correction metric	used_motion_correction == 1		motion correction metric	1	3						c3d13017-259e-4ee3-851a-621a4f68b220
Preprocessing	4	13	Interpolation method used for motion correction			select	preset:interpolations		motion correction interpolation	used_motion_correction == 1		motion correction interpolation	1	3						dee787dd-34c8-4e0e-8710-73437aa532ee
Preprocessing	4	14	Was motion-susceptibility correction used?			radio	preset:boolean		used motion susceptibiity correction	1		used motion susceptibiity correction	1	3						c77e83a5-082e-4fa2-9937-3369ce2a7403
Intersubject registration	5	1	Were subjects registered to a common stereotactic space?			radio	preset:boolean		used intersubject registration	1		used intersubject registration	1	1	Describe your spatial normalization					9db7fbc9-34f0-41ec-8ad4-d4fa3cf99fe8
Intersubject registration	5	2	Specify software used for intersubject registration if different from main package			select	preset:mri_softwares		intersubject registration software	used_intersubject_registration == 1		intersubject registration software	1	2						8419ef71-d0ce-41b8-ad8a-c3e9e93dfaeb
Intersubject registration	5	3	Was linear or nonlinear registration used?			select	linear | non-linear		intersubject transformation type	used_intersubject_registration == 1		intersubject transformation type	1	1						3d08d69d-6a05-4b3e-89a5-b01d1082db90
Intersubject registration	5	4	If nonlinear registration was used, describe transform method			textarea			nonlinear transform type	used_intersubject_registration == 1 and nonlinear_transform_type == 1		nonlinear transform type	1	2						9355eaf3-0833-427a-abf3-2ceef677b6f9
Intersubject registration	5	5	Similarity metric used for intersubject registration			textarea			transform similarity metric	used_intersubject_registration == 1		transform similarity metric	1	3						89bd655c-8779-422a-8415-ae9fec422ef2
Intersubject registration	5	6	Interpolation method used for intersubject registration			select	preset:interpolations		interpolation method	used_intersubject_registration == 1		interpolation method	1	2						afc4cf11-715f-4cf0-8331-359422a22ae0
Intersubject registration	5	7	What type of image was used to determine the transformation to the atlas?			textarea			object image type	used_intersubject_registration == 1		object image type	1	1						f4126278-a1e9-41f1-9028-0152e7096b6f
Intersubject registration	5	8	Were the functional images coregistered to the subject's structural image?			radio	preset:boolean		functional coregistered to structural	1		functional coregistered to structural	1	2						845fe1f7-ec62-46da-81fd-a3e67f6f2da1
Intersubject registration	5	9	Method used to coregister functional to structural images			textarea			functional coregistration method	functional_coregistered_to_structural == 1		functional coregistration method	1	3						dae01d0b-d0fa-40d5-8d7e-078648f2aae6
Intersubject registration	5	10	Name of coordinate space for registration target			select	MNI | Talairach | MNI2Tal | other		coordinate space	1		coordinate space	1	1						9e83e954-df36-4e61-900b-85c2514f821c
Intersubject registration	5	11	Name of target template image			textarea			target template image	1		target template image	1	2						556ed9f6-a863-4e3d-a784-c7fce4062a65
Intersubject registration	5	12	Voxel size of target template	Millimeters		float	0		target resolution	1		target resolution	1	1						ef59516e-d912-4356-aed6-0b98249aa6de
Intersubject registration	5	13	Was spatial smoothing applied?			radio	preset:boolean		used smoothing	1		used smoothing	1	1						f62fb193-e970-4725-9cda-e1ea989506b3
Intersubject registration	5	14	Describe the type of smoothing applied			textarea			smoothing type	used_smoothing == 1		smoothing type	1	1						e4be0753-decd-456f-bba3-0b6c40ab93a6
Intersubject registration	5	15	The full-width at half-maximum of the smoothing kernel	Millimeters		float	0		smoothing fwhm	used_smoothing == 1		smoothing fwhm	1	1						55894c85-6652-486d-956c-5d6821b57311
Intersubject registration	5	16	Voxel size in mm of the resampled, atlas-space images			float	0		resampled voxel size	1		resampled voxel size	1	1						27ad3084-e4d0-4d43-a8de-3fdd53cebe8e
Individual subject modeling	6	1	Type of group model used			radio	Regression | other		intrasubject model type	1		intrasubject model type	1	1	Describe your model specification at the subejct level					0902a9d0-9a7e-48d8-bda5-2fdd07a03f65
Individual subject modeling	6	2	Estimation method used for model			select	ordinary least squares | generalized least squares | other		intrasubject estimation type	1		intrasubject estimation type	1	1						17267f34-6265-4a2b-bcba-c5f24c57d1e2
Individual subject modeling	6	3	Software used for intrasubject modeling if different from overall package			select	preset:mri_softwares		intrasubject modeling software	1		intrasubject modeling software	1	2						5d251667-65c5-4d48-9699-1e1a21526576
Individual subject modeling	6	4	Nature of HRF model			select	spm HRF | glover HRF | double gamma | Fourrier set | Finite Impulse Response | FLOBS | other		hemodynamic response function	1		hemodynamic response function	1	2						1ca6ecab-c2c4-447e-84ad-1bf4a4f1a241
Individual subject modeling	6	5	Were temporal derivatives included?			radio	preset:boolean		used temporal derivatives	1		used temporal derivatives	1	2						50ef2585-02aa-4c52-815a-2b0f535539ff
Individual subject modeling	6	6	Were dispersion derivatives included?			radio	preset:boolean		used dispersion derivatives	1		used dispersion derivatives	1	3						9bbc294a-a0cf-46d4-af2c-28635869db24
Individual subject modeling	6	7	Were motion regressors included?			radio	preset:boolean		used motion regressors	1		used motion regressors	1	2						4850102d-5d86-4e3a-873a-fd888db7d7a3
Individual subject modeling	6	8	Was a reaction time regressor included?			radio	preset:boolean		used reaction time regressor	1		used reaction time regressor	1	2						41280290-2d94-40f4-a277-3278d1066dd9
Individual subject modeling	6	9	Were any regressors specifically orthogonalized with respect to others?			radio	preset:boolean		used orthogonalization	1		used orthogonalization	1	1						b969099b-1169-4764-a194-463a75a98a53
Individual subject modeling	6	10	If orthogonalization was used, describe here			textarea			orthogonalization description	used_orthogonalization == 1		orthogonalization description	1	2						b6601516-6f1a-4e98-994a-58fdffc1597f
Individual subject modeling	6	11	Was high pass filtering applied?			radio	preset:boolean		used high pass filter	1		used high pass filter	1	1						0335cd19-c0c4-495c-a918-2c2fa2e98b94
Individual subject modeling	6	12	Describe method used for high pass filtering			textarea			high pass filter method	used_high_pass_filter == 1		high pass filter method	1	2						a21a8a39-a654-4b70-80b2-f1f70985e1f6
Individual subject modeling	6	13	What autocorrelation model was used ?			select	SPM: global approximate AR(1) | SPM: FAST | FSL: locally regularized autocorrelation function | AFNI: ARMA | none | other		autocorrelation model	1		autocorrelation model	1	2						8b6a5eaa-cd3d-402c-af0a-5fe5d31693c3
Individual subject modeling	6	14	Exactly what terms are subtracted from what?			textarea			contrast definition	1		contrast definition	1	1						97cdc343-caad-4045-b23b-9d2d0a026b59
Individual subject modeling	6	15	Link to Cognitive Atlas definition of this contrast		Define these in terms of task or stimulus conditions (for example 'one-back task with objects versus zero-back task with objects') instead of underlying psychological concepts (for example 'working memory').	textarea			contrast definition cogatlas	1		contrast definition cogatlas	1	3						8a0bd4c0-1df0-46f9-92e7-1c94795b3ce7
Group modeling	7	1	Type of group model used			select	Regression		group model type	1		group model type	1	1	Describe the group level analysis					27737a38-a1ec-4cbb-992c-4f1e0241d892
Group modeling	7	2	Estimation method used for model			select	ordinary least squares | generalized least squares | other		group estimation type	1		group estimation type	1	1						e6833ced-e8d0-4ff9-9790-383e3a8d2e17
Group modeling	7	3	Software used for group modeling if different from overall package			select	preset:mri_softwares		group modeling software	1		group modeling software	1	2						feac1baa-ce25-4076-b438-665789ba36c5
Group modeling	7	4	Type of inference for group model			select	random effect | mixed effect | fixed effect		group inference type	1		group inference type	1	1						addfe505-a968-41f2-ac6d-0a32748fc058
Group modeling	7	5	If more than 2-levels, describe the levels and assumptions of the model.		For example, are variances assumed equal between groups.	textarea			group model multilevel	1		group model multilevel	1	3						68fee6e4-62cc-4561-b45f-524746874740
Group modeling	7	6	Was this a repeated measures design at the group level?			radio	preset:boolean		group repeated measures	1		group repeated measures	1	1						1ed8231d-0bf2-41f8-8f82-7f7edb89abdc
Group modeling	7	7	If multiple measurements per subject, list method to account for within subject correlation, exact assumptions made about correlation/variance			textarea			group repeated measures method	group_repeated_measures == 1		group repeated measures method	1	3						38a7bad7-4ae1-4fa5-8897-a87d13a3275c
Group inference	8	1	Type of statistic that is the basis of the inference			select	Z | T | F | X2 | PostProb | Non-parametric Permutations | Monte Carlo Permutations | other		group statistic type	1		group statistic type	1	2	Describe your statistical inference					17649732-cb4f-4c25-a52e-f08e8cb4669a
Group inference	8	2	Parameters of the null distribution of the test statisic.		Typically degrees of freedom (should be clear from the test statistic what these are).	float			group statistic parameters	1		group statistic parameters	1	1						1f76a886-83ca-4fc8-9acd-b4e2df7f2d78
Group inference	8	3	Noise smoothness for statistical inference		This is the estimated smoothness used with Random Field Theory or a simulation-based inference method.	float	0		group smoothness fwhm	1		group smoothness fwhm	1	1						d96f012f-eac1-4f30-9f09-936e1065c6fc
