sub_section	preamble	question	unit	details	field_type	choices	item_pref_label	visibility	item_order	include	mandatory	activity_pref_label	activity_order
Artifacts		Which other reasons did you have for eliminating bad electrodes visually in step 7?			text		artifact_7_remove_electrode_visual_other	artifact_steps_number >= 7 && artifact_7_remove_electrode_visual == 6	202	1	1	Preprocessing	5
Artifacts		Describe your numerical criterion/function for eliminating electrodes and provide numerical threshold(s) in step 7.			text		artifact_7_remove_electrode_numerical	artifact_steps_number >= 7 && artifact_7_remove_electrode_method == 1	203	1	1	Preprocessing	5
Artifacts		Describe your method of electrode rejection other than visual inspection or numerical criterion/function. Make sure that there is enough detail for a replication attempt.			text		artifact_7_remove_electrode_other	artifact_steps_number >= 7 && artifact_7_remove_electrode_method == 2	204	1	1	Preprocessing	5
Artifacts		How did you select channels for interpolation in step 7?		Describe the numerical threshold or function used to define which channels should be interpolated.	textarea		artifact_7_interpolate_which	artifact_steps_number >= 7 && artifact_7 == 3	205	1	1	Preprocessing	5
Artifacts		Describe interpolation function and the settings you used in step 7.		Provide appropriate details and settings, as well as a reference, if appropriate.	textarea		artifact_7_interpolate_how	artifact_steps_number >= 7 && artifact_7 == 3	206	1	1	Preprocessing	5
Artifacts		Reference to the automated artifact removal algorithm used in step 7			text		artifact_7_automated_reference	artifact_steps_number >= 7 && artifact_7 == 4	207	1	1	Preprocessing	5
Artifacts		Describe automated artifact removal parameters in detail sufficient for replication.		For example, provide numerical parameters, options selected, or describe decision-making process as closely as possible if manual, visual-inspection based decisions were involved.	textarea		artifact_7_automated_parameters	artifact_steps_number >= 7 && artifact_7 == 4	208	1	1	Preprocessing	5
Artifacts		We are sorry, but this is an early version of the web-app, and it currently includes up to 7 steps of artifact removal decisions due to technical limitations. Describe your remaining decisions in this field as detailed as you can.			textarea		artifact_removal_more_than_7	artifact_steps_number >= 8 && artifact_7 == 4	209	1	1	Preprocessing	5
Epoching		Did you epoch data outside of the automated pre-processing pipelines described earlier?			radio	preset:boolean	epoch_any	1	210	1	1	Preprocessing	5
Epoching		Which analysis software did you use for epoching EEG data?			select	preset:meeg_analysis_softwares	epoch_software	same_software == 0 && epoch_any == 1	211	1	1	Preprocessing	5
Epoching		Specify software version if applicable, script language if "custom script" was selected, and software name and version if "other" was selected.			text		epoch_software_details	same_software == 0  && epoch_any == 1	212	1	1	Preprocessing	5
Epoching		What was the epoch beginning relative to a trigger point? For timings after the trigger, use positive numbers. For timings before the trigger, use negative numbers.	ms		float		epoch_beginning	epoch_any == 1	213	1	1	Preprocessing	5
Epoching		What was the event type relative to which epochs were defined?			radio	stimulus onset | response | feedback onset | other	epoch_trigger_event	epoch_any == 1	214	1	1	Preprocessing	5
Epoching		If other, what is the event?			text		epoch_trigger_event_other	epoch_trigger_event == 3	215	1	1	Preprocessing	5
Epoching		What was the epoch end relative to a trigger point? For timings after the trigger, use positive numbers. For timings before the trigger, use negative numbers.	ms		float		epoch_end	epoch_any == 1	216	1	1	Preprocessing	5
Baseline correction		Did you apply baseline correction?		This does not include baseline correction within automated pipelines, if you had applied any.	radio	preset:boolean	baseline_any	1	217	1	1	Preprocessing	5
Baseline correction		Which analysis software did you use for baseline correction?			select	preset:meeg_analysis_softwares	baseline_software	same_software == 0 && baseline_any == 1	218	1	1	Preprocessing	5
Baseline correction		Specify software version if applicable, script language if "custom script" was selected, and software name and version if "other" was selected.			text		baseline_software_details	same_software == 0 && baseline_any == 1	219	1	1	Preprocessing	5
Baseline correction		What was the baseline period beginning relative to a trigger point? For timings after the trigger, use positive numbers. For timings before the trigger, use negative numbers.	ms		float		baseline_beginning	baseline_any == 1	220	1	1	Preprocessing	5
Baseline correction		What was the baseline period end relative to a trigger point? For timings after the trigger, use positive numbers. For timings before the trigger, use negative numbers.	ms		float		baseline_end	baseline_any == 1	221	1	1	Preprocessing	5
Baseline correction		Which baseline calculation method was used?			radio	subtract mean of the baseline period per condition | other	baseline_method	baseline_any == 1	222	1	1	Preprocessing	5
Baseline correction		Describe your baseline calculation method other than subtraction of the mean of the baseline.			textarea		baseline_other_method_details	baseline_method == 1	223	1	1	Preprocessing	5
Order of operations		Describe order of all pre-processing steps described here in a way that allows replication.			textarea		preprocessing_order	1	224	1	1	Preprocessing	5
